Title,City,Company,Type,Date Posted,Experience Needed,Career Level,Education Level,Salary,Description,,,,,,,,,
Senior NET Developer,Giza,WSC,Full Time,Posted 15 days ago,3 to 7 years,Experienced (Non-Manager),Not Specified,20000 to 40000 EGP Per Month Salary USD,Analyze system requirements and prioritize tasksWrite clean testable code using .NET programming languagesDevelop technical specifications and architectureTest and debug various .NET applicationsReview and refactor codeDeploy fully functional applicationsUpgrade existing programsSupport junior developers’ workDocument development and operational procedures.NET CoreAngular 10+Apb.io Framework preferredDDD & CQRSMicroservicesApi getawayEF Core,,,,,,,,,
Senior Flutter Developer,Cairo,ثقة الانجاز,Full Time,Posted 15 days ago,More than 3 years,Experienced (Non-Manager),Bachelor's Degree,Confidential In Terms Of Compensation We Offer Competitive Salaries In Either USD Or SAR Medical Social Insurance And Transportation Allowance.,At Wtheq we are dedicated to providing innovative solutions and services to meet the growing demands of the Saudi market. As we expand our operations we are looking to hire talented individuals to join our team.As part of our commitment to creating a supportive and collaborative work environment we offer our employees high-end PCs with dual screens to enhance productivity.  Our office is located in a premium location at Cairo Festival City CFC providing a comfortable and modern workspace.  In terms of compensation we offer competitive salaries in either USD or SAR Medical Social Insurance and Transportation Allowance. Job Description: Building multi-platform applications for Android and iOS using the Flutter development framework Ensuring consistency between the delivered product features and the requirements/criteria of the business.Develop mobile applications for iOS and Android platforms using React Native or Swift.Collaborate with cross-functional teams to gather requirements and design application architecture.Write clean maintainable and efficient code for mobile apps.Conduct testing and debugging to ensure the functionality and performance of mobile applications.Integrate with backend services and APIs.Stay updated with the latest mobile app development trends and best practices.,,,,,,,,,
Senior Quality Control Engineer,Cairo,ثقة الانجاز,Full Time,Posted 15 days ago,More than 3 years,Experienced (Non-Manager),Bachelor's Degree,Confidential In Terms Of Compensation We Offer Competitive Salaries In Either USD Or SAR Medical Social Insurance And Transportation Allowance.,At Wtheq we are dedicated to providing innovative solutions and services to meet the growing demands of the Saudi market. As we expand our operations we are looking to hire talented individuals to join our team.As part of our commitment to creating a supportive and collaborative work environment we offer our employees high-end PCs with dual screens to enhance productivity.  Our office is located in a premium location at Cairo Festival City CFC providing a comfortable and modern workspace.  In terms of compensation we offer competitive salaries in either USD or SAR Medical Social Insurance and Transportation Allowance. Job Description: Develop and execute Automation tests cases and test automation scriptsInvestigate the product and effectively identify where breakage may occurPerform all testing activities including bug reporting and retesting root-cause analysis regression testing and acceptance testingReview functional specifications and participate in the product design processEstimate prioritize and plan testing activitiesGenerate status reports and summarize testing progress in project team meetingsMonitor other team members and work with team leads on developing their technical and interpersonal skillsImplement track and report key metrics to assure full coverage of functional and non-functional requirementsReceive and handle issues reported externally,,,,,,,,,
Senior Full Stack Developer,Giza,El-Sewedy Electrometer,Full Time,Posted 15 days ago,4 to 8 years,Experienced (Non-Manager),Bachelor's Degree,Confidential Transportation Allowance - Variable pay - Medical & Social Insurance - Flexible hours - Working From Home,Provide development enhancement troubleshooting and maintenance for software applicationsWrite clean and testable codeReview and approve code changesIdentifying troubleshooting and debugging defects in designated application codeProvides technical/engineering support for new and existing applications.Participate in activities accordingly to ensure on time implementation deliverables are met including day-to-day planning and coordination with other stakeholders.Provides reasonable task and project effort estimates.Ensure timely effective and quality delivery of software into testing and production environments.Creates required technical documentation.Collaboratively work with business representatives to define requirements and develop technical specifications.Analyze system requirements and prioritize tasksSupport junior engineers,,,,,,,,,
Senior Backend Developer,Cairo,ثقة الانجاز,Full Time,Posted 15 days ago,More than 3 years,Experienced (Non-Manager),Bachelor's Degree,Confidential In Terms Of Compensation We Offer Competitive Salaries In Either USD Or SAR Medical Social Insurance And Transportation Allowance.,At Wtheq we are dedicated to providing innovative solutions and services to meet the growing demands of the Saudi market. As we expand our operations we are looking to hire talented individuals to join our team.As part of our commitment to creating a supportive and collaborative work environment we offer our employees high-end PCs with dual screens to enhance productivity.  Our office is located in a premium location at Cairo Festival City CFC providing a comfortable and modern workspace.  In terms of compensation we offer competitive salaries in either USD or SAR Medical Social Insurance and Transportation Allowance. Job Description: Take part in designing building and maintaining our highly platformsTackle new challenges in different system areas (architecture access control data handling caching performance tuning).Take ownership of new features and modules; study them and work on them along with other teammates.Develop functional and sustainable web applications with clean codes.Collaborate with the front-end team and other stakeholders to establish objectives and design more functional cohesive codes to enhance our user experience.Remove the errors and bugs in the applications and make them better for the user.Manage and review code contributed by the rest of the team and work with them to get it ready for productionAssist with other related tasks as required,,,,,,,,,
Senior Frontend Developer,Cairo,ثقة الانجاز,Full Time,Posted 15 days ago,More than 3 years,Experienced (Non-Manager),Bachelor's Degree,Confidential In terms of compensation we offer competitive salaries in either USD or SAR Medical Social Insurance and Transportation Allowance.,At Wtheq we are dedicated to providing innovative solutions and services to meet the growing demands of the Saudi market. As we expand our operations we are looking to hire talented individuals to join our team.As part of our commitment to creating a supportive and collaborative work environment we offer our employees high-end PCs with dual screens to enhance productivity.  Our office is located in a premium location at Cairo Festival City CFC providing a comfortable and modern workspace.  In terms of compensation we offer competitive salaries in either USD or SAR Medical Social Insurance and Transportation Allowance. Job Description: Take part in designing building and maintaining our online platforms.Tackle new challenges in different system areas (architecture data handling caching performance tuning).Contribute to the Frontend team roadmap and follow up on its progress.Take ownership of new features and modules: study them split them into tasks and work with other teammates.Develop new user-facing features.Build reusable code and libraries for future use.Remove the errors and bugs in the applications and make them better for the user.Do other job related tasks as required,,,,,,,,,
Laravel Developer,Cairo,CyberX,Full Time,Posted 15 days ago,More than 3 years,Experienced (Non-Manager),Bachelor's Degree,Confidential,Design and build advanced applications for our platformsCollaborate with cross-functional teams to define design and ship new featuresWork with outside data sources and APIsUnit-test code for robustness including edge cases usability and general reliabilityWork on bug fixing and improving application performanceContinuously discover evaluate and implement new technologies to maximize development efficiency,,,,,,,,,
Flutter developer,Cairo,CyberX,Full Time,Posted 15 days ago,More than 3 years,Experienced (Non-Manager),Bachelor's Degree,Confidential,Design and build advanced applications for our platforms.Collaborate with cross-functional teams to define design and ship new features.Work with outside data sources and APIsUnit-test code for robustness including edge cases usability and general reliabilityWork on bug fixing and improving application performanceContinuously discover evaluate and implement new technologies to maximize development efficiency,,,,,,,,,
Vue.JS Frontend Developer,Cairo,CyberX,Full Time,Posted 15 days ago,More than 3 years,Experienced (Non-Manager),Bachelor's Degree,Confidential,Use markup languages to create user-friendly web pagesMaintain and improve our solutionsOptimize applications for maximum speedDesign mobile-based featuresCollaborate with back-end developers and web designers to improve usabilityGet feedback from and build solutions for users and customersWrite functional requirement documents and guidesCreate quality mockups and prototypesHelp back-end developers with coding and troubleshootingEnsure high quality graphic standards and brand consistencyStay up-to-date on emerging technologies,,,,,,,,,
Senior iOS and Flutter Developer,Cairo,Softec Technologies,Full Time,Posted 15 days ago,5 to 8 years,Experienced (Non-Manager),Not Specified,Confidential,Develop and maintain mobile applications for iOS and Android devices using the Flutter framework.Develop and maintain native iOS applications.Architect design and implement business required functionalities.Ensure the performance quality and responsiveness of applications.Collaborate with other developers designers and product managers to deliver high-quality products.Mentor and provide guidance to junior developers on the team.Conducts code reviews and provides mentorship sharing knowledge with team members to maintain high code quality standards.Contribute to the continuous improvement of our mobile development processes.Implement best practices for software development including unit testing code review and continuous integration.,,,,,,,,,
Team Leader Software Tester / Quality Control Engineer,Dakahlia,qTech.,Full Time,Posted 15 days ago,More than 5 years,Experienced (Non-Manager),Bachelor's Degree,Confidential,Job Summary:As the Software Quality Control Team Leader you will be responsible for leading and managing a team of quality control engineers to ensure the delivery of high-quality software products. Your primary focus will be on planning implementing and executing quality control processes and procedures throughout the software development lifecycle.Responsibilities:Lead the Quality Control team and coordinate their daily activities to ensure optimum planning of resources and a fully-motivated competent workforceUsing the software as intended to analyze its functional properties.Designing test procedures to evaluate each software product.Running test programs to ensure that testing protocols evaluate the software correctly.Tweaking the software testing systems for maximum performance.Finalizing and documenting testing procedures.Completing final tests and creating test reports.Presenting test reports to management and suggesting software fixes.Reporting and documenting technical issues.Review and analyze system specifications.Execute test cases (manual or automated) and analyze results.Evaluate product code according to specifications.Report bugs and errors to development teams.Conduct post-release/ post-implementation testing.Work with cross-functional teams to ensure quality throughout the software development life-cycle.,,,,,,,,,
Software Engineer,Cairo,AGG information technolo...,Full Time,Posted 15 days ago,2 to 3 years,Experienced (Non-Manager),Bachelor's Degree,Confidential,Execute the entire software development life cycle (SDLC)Develop flowcharts layouts and documentation to identify requirements and solutionsWrite well-designed testable codeProduce specifications and determine operational feasibilityGood Experience in Integration software components into a fully functional software systemGood knowledge of E-commerce web application systemDevelop software verification plans and quality assurance proceduresDocument and maintain software functionalityTroubleshoot debug and upgrade existing systemsDeploy programs and evaluate user feedbackComply with project plans and industry standardsEnsure software is updated with the latest features,,,,,,,,,
Sr. Devops Engineer,Cairo,waffarha.com,Full Time,Posted 15 days ago,3 to 5 years,Experienced (Non-Manager),Bachelor's Degree,Confidential,Work objectiveThe Senior DevOps Engineer will play a central role within our technology department. They will assume ownership and accountability for designing guiding and executing cloud infrastructure solutions. Their primary objectives include automating deployment procedures to reduce reliance on manual interventions monitoring system health setting up alerts and effectively resolving any system issues that may arise. Furthermore they will collaborate with development teams to assist in prototyping constructing and managing both current and upcoming services prior to their deployment.Responsibilities● Crafting cloud-based network and infrastructure architectures.● Deploying diverse development testing and automation tools alongside IT infrastructure.● Administering core systems overseeing monitoring and maintaining operational services.● Strategizing coordinating and executing security measures to safeguard data and software.● Collaborating on the development and testing of novel systems and solutions.● Investigating diagnosing and resolving software and application issues in collaboration with both local and global teams.● Independently working on project deliverables when necessary.● Orchestrating software and system installations while keeping meticulous software license records. ● Planning and executing scheduled maintenance upgrades.● Managing backups and overseeing disaster recovery operations.● Offering recommendations for system enhancement and performance optimization.● Modifying existing software to rectify errors adapt to new hardware and enhance interfaces for improved performance.● Preparing reports and correspondence related to project specifications and activities.● Actively participating in various projects and system-related activities.,,,,,,,,,
Technical Support Agent (Fluent English Speaker),Cairo,3D Diagnostix,Full Time,Posted 15 days ago,More than 1 year,Entry Level (Junior Level / Fresh Grad),Bachelor's Degree,11000 to 12500 EGP Per Month Monthly Profit Share In US Dollars -  Social & Medical Insurance.,What we're looking for is a tech-savvy who is knowledgeable about computer systems and software applications and must be a Fluent English Speaker as he/she will be supporting our American clients.Responsibilities : Identifying hardware and software solutions.Troubleshooting technical and network issues.Installing and configuring hardware and software.Speaking to clients to pinpoint the issue and quickly resolve it.Guiding clients through a series of actions to resolve a problem or first-time setup.Following up with clients to ensure the problem is resolved.Managing multiple tasks at one time.Document technical knowledge in the form of internal databases and manuals.,,,,,,,,,
Senior Backend Developer,Alexandria,Art Link,Full Time,Posted 15 days ago,4 to 7 years,Experienced (Non-Manager),Not Specified,Confidential,Build effective testable and reusable PHP modules.Integration of user-facing elements developed by front-end developersSolve complex performance problems and architectural challenges,,,,,,,,,
Senior Application Support Officer,Cairo,El Sewedy Education - The Knowledge Hub Universities,Full Time,Posted 15 days ago,2 to 5 years,Entry Level (Junior Level / Fresh Grad),Not Specified,Confidential *Transportation provided. *Social Insurance *Family Medical Insurance *Bonus according to company policy,Accountable for the organization’s applications start to end process Collaborate with a team of IT professionals to set specifications for new applicationsWrite high quality source code to program complete applications within deadlinesTroubleshoot and debug applications' problemsEvaluate existing applications to reprogram update and add new featuresDevelop technical documents and handbooks to accurately represent application design and codeResponsible for ticketed query system and ensures comprehensive database of queries and resolutions is kept up to date. Provide technical support to different stakeholder within the organization. Assist in providing technical trainings for staff and faculty. Provide support to students for accessing and using their systems. Design and create reports and dashboards. Responsible for the documentation process by maintaining and updating technical documents and procedures.Assist with systems integrations. Assist in implementing new solutions according to business needs.Liaise with the vendors & other IT functions for problem resolution.Assist in designing new projects according to business needs.  Align and test new projects with the vendors.Maintain security backup and redundancy strategies. Ensure compliance with IT policies & procedures.,,,,,,,,,
IT Help Desk,Giza,El Alsson British & American International School,Full Time,Posted 15 days ago,3 to 5 years,Experienced (Non-Manager),Not Specified,Confidential,IT Help Desk role is to provide fast and effective support to our clients (teachers students and Administration Staff). You will be required to respond to queries in person and over the phone. You may also be required to provide basic computer training modify hardware systems install computer peripherals and perform basic computer maintenance.Responsible for all devices in their area like Pcs laptops IPads tablets desktop phones projectors speakers screens printers Wi-Fi and surveillance cameras. Responsible for checking reviewing and maintaining all equipment’s and systems to be up to date functioning well and avoid any maintenance issue to take place.Responsible for fixing and arranging cables connectivity and the IT rack room in terms of equipment’s.Support teachers and students and administration staff as per the request received from the IT ticketing system or from IT team leader. Support teachers and administration staff in how to use some systems software programs and applications as requested. Monitoring and respond quickly and effectively to requests received through the IT ticketing system.Installing testing and configure new workstations equipment and softwareSupporting the IT team in other areas if necessary and requested especially in peak times like preparation for school entrance technical issue etc.,,,,,,,,,
Senior Technical Support Engineer ( French speaker),Cairo,Schneider Electric - Egypt,Full Time,Posted 16 days ago,Not Specified,Not specified,Not Specified,Confidential,Job SummaryWho are we and what we stand for?When you work for Schneider Electric you work for a company that is passionate about its people. Our people vision says Great people make Schneider Electric a great company. We are proud to promote purpose diversity inclusion learning and work-life integration – we’re a great place to work and we are continually striving to be the best place to work!Your MissionWe are looking for a good candidate to support all the technical inquiries r in Schneider for MEA  countries.Your Role – Magic happens when you bring great people together!-          Selection of the products complying to the customer requirements & application &  Providing Legacy cross reference-          Advising other products suiting the customer (Up selling & Cross selling)  Product Configuration  &Troubleshooting the customer issue at the site-          Guide the customer for product operation & quick start-          Provide advanced technical Support to Customers.  Ability to reply on basic requests related to equipment.-          Responsible to facilitate promotional work shops / seminars .Participate as sales support in prescribing various Products for decision makers-          Responsible of getting continuous updates from Knowledge based and inform concerned parties. Provide added value continuous improvement for the customer care . Identify sales opportunity through customer contact with a reporting through cases to sales team.-          Specifications with the relevant product / price .-          Increase the level of customer satisfaction To be measured Quarterly through survey and random calls to insure the quality of reply.About You-          Bachelor University degree in an engineering profession ( Electrical Mechatronics Renewable energy Electronics & Communications).-          Fluency in English is a must.-          Fluency in French is a must-          Professional user of Microsoft Office.-          Working with team.-          Adhering to the principals & values.-          Learning & Researching.-          Adapting and responding to changes.,,,,,,,,,
Great Schedule for an Active & Fun-loving Nanny,Alexandria,White House Nannies Inc.,Full Time,Posted 16 days ago,Not Specified,Not specified,Not Specified,Confidential,Location Chevy Chase Education Requirements No Education requirement Experience Requirements 4+ years DescriptionThis wonderful and active family in Chevy Chase is looking for enthusiastic social and engaging nanny to help keep their joyful home running smoothly. They have 4 children ages 8 (twins) 6 and 2 ½ years old. The youngest will be in preschool until 12pm and the older kids until 3pm. Key responsibilities include kids’ laundry meal prep and errands before walking to pick up the 2.5 year-old from school. When the 3 older kids get home there may be homework supervision and driving to and from activities until your end time (4:30 pm!). The kids’ schools are all walking distance from the home and a car will be provided for any activities you need to drive to. This is a wonderful role for someone playful and proactive who likes to get the kiddos out of the house. If you enjoy being around kids and value an active and nurturing environment we’d love to hear from you!Qualifications⭐️ At least 5 years of professional nannying experience⁣ ⭐️ Must be legal to work in the US ⭐️ Must be local to the DC-metro area (DC MD VA) ⭐️ Licensed driver with a clean driving record & car⁣ ⭐️ Must be COVID-Vaccinated & Boosted if eligibleWhy Work With Us Free for Job Seekers Highest Paying Jobs Benefits Ongoing Training & Support* Community,,,,,,,,,
Specialist Big Data Administrator - SWDC,Cairo,Giza Arabia Systems,Full Time,Posted 16 days ago,Not Specified,Not specified,Not Specified,Confidential,Specialist Big Data Administrator - SWDCJob Description Manage and maintain our Big Data infrastructure including HBase Elastic search and Cloudera. Perform configuration tuning and ongoing optimization of big data infrastructure and applications. Develop and implement processes for data ingestion processing and storage. Work with other members of the DevOps team to troubleshoot and resolve issues related to Big Data systems. Work with data scientists and architects to understand their infrastructure and analytics needs and provide solutions. Collaborate with Data Engineers and Data Scientists to ensure data is available and accessible for analysis. Develop and maintain documentation related to Big Data systems and processes. Stay up to date with advances in big data technologies and tools. Research and recommend new solutions as needed. Educate and train junior DevOps team members on Big Data technologies and best practices.Personal Skills Good command of English language. Excellent analytical skills. Excellent interpersonal skills. Excellent written and verbal communication skills. Ability to prioritize and organize multiple assignments/tasks. Strong problem-solving mindset. Ability to adapt to constantly changing environment.Technical Skills• Expertise in Hadoop ecosystem technologies such as HDFS Hive HBase Spark Kafka Flink and NiFi. • Experience with Hadoop-based Ecosystems like Cloudera including its different compartments like CDP CDF and CML. • Expertise in ELK Stack (Elastic Search Kibana LogStash) and administration of logging systems over them. • Knowledge of distributed computing cloud computing architectures and data processing frameworks such as Apache Spark. • Experience with data ingestion and processing tools such as Kafka and Flume. • Strong communication and collaboration skills. • Ability to train and educate junior team members on Big Data technologies and best practices. • Ability to work independently and as part of a team. • Eperties in Teradata PowerBI Server and Informatica as are a plus.EducationB.Sc. of Engineering or Computer Science or relevantJob Location Cairo Egypt Job Role Engineering Years of Experience Min: 5,,,,,,,,,
