Title,City,Company,Type,Date Posted,Experience Needed,Career Level,Education Level,Salary,Description,,,,,,,,,
Senior Aris Developer,Cairo,Giza Arabia Systems,Full Time,Posted 9 days ago,Not Specified,Not specified,Not Specified,Confidential,Senior Aris DeveloperJob Description Work as a team member and identify and implement feasible architectural approaches. Perform unit testing and resolve defects in a development environment maintaining the security of all system applications. Troubleshoot application issues coding bugs and bottlenecks. Work on dynamic data handling such as data pages Change triggers and agents. Work on BPM workflow development including UI components and tools. Provide reporting functions using Report Definitions List Views and Summary Views. Support internal architecture design: locking architecture advanced agents rule assembly and execution. Meet with business managers to discuss t BPM application needs and work with business architects and system end-users.Personal Skills Bachelor’s degree in computer science Engineering or a related field. Having experience in performance optimization both in frontend and backend side. Familiarity with modelling tools software development concepts and software implementation methodologies. Familiarity with project management methodologies. Ability to qualitatively develop project documentation in accordance with local standards and regulations. Experience and knowledge of standards for writing functional requirements/business requirements / technical specifications for software development.Technical Skills-At least 4 years of experience in BPM. -At least 2 years of experience in Aris. -Experience with other BPM tools will be an advantage (Camunda Pega). -Having strong proficiency across all areas of BPM and best practices standards to provide insights on problems across functional areas. -Experience in BPM Development including UI Design coach view. -Having strong proficiency in using the BPM Rest Service web service -Knowledge of business process modelling notations: ARIS UML BPMN 2.0 User Stories. -Strong Knowledge of Software AG.Job Location Cairo Egypt Job Role Information Technology Years of Experience Min: 4 Max: 7,,,,,,,,,
Presales Manager - Enterprise Business Solutions,Cairo,Giza Arabia Systems,Full Time,Posted 9 days ago,Not Specified,Not specified,Not Specified,Confidential,Presales Manager - Enterprise Business SolutionsJob Description Promotes Giza Systems’ image and culture internally & externally.  Performs pre-investigation data gathering and requirement analysis at the customer premises.  Develops advanced solution architecture and review technical function specifics documents.  Assists the customer in defining his business needs and choosing the proper solution.  Reviews the estimates and sizes the customer requirements with reference to the pre-investigation and using the help of the technical/functional staff or third party if necessary.  Prepares and conducts presentation on the proposed solution if required by the customer.  Receives assistance from Development Consultants and technical/ functional Staff to fill compliance Sheets (if required).  Support the Responds to customer inquiries to explain the proposed solution.  Receives the Request for Proposal (RFP) from the presales manager and redirect it to consultation team after analyzing the RFP and convert it into components.  Reviews the prepared technical write-up and the costing of the proposed solution.  Ensures the RFP response integrity & review all the integrations & services required between the components of the solution.  Reviews and updates the prepared technological trends analysis reports & new solution coverage report.  Prepares Customer gap analysis & process mapping document. Personal Skills Excellent English and Arabic Business and Technical writing skills. Team Leadership. Technical Skillso Extensive understanding of digitalization transformation projects/needs. Including Workflow automation RPA Mobile APP (Omni Channel) o Understanding/exposure to utilities solutions including: Customer Care and Billing Meter Data Management Work and Asset Management Mobile Workforce Management Network Management System o Knowledge emerging technologies like IOT Blockchain Advanced Analytics & AI/ML 5G Industry 4. o knowledge of ITIL/PMP or similar practices o knowledge of BI Data Mining or similar practice o Excellent pre-sales technical skills o Existing customer exposure is essential.Job Location Cairo Egypt Job Role Sales Years of Experience Min: 10 Max: 15,,,,,,,,,
Junior Software Engineer,Cairo,MegaSoft,Full Time,Posted 9 days ago,0 to 2 years,Entry Level (Junior Level / Fresh Grad),Bachelor's Degree,Confidential Health Insurance  Yearly Bonus,This is a Software Engineering / IT Service Management vacancy. You will mainly work on configuring customizing and developing enhancements for Enterprise Solutions from IBM Software Solutions Portfolio. This is a unique opportunity to be part of a leading Global IT organization with real opportunity for career growth. This is a challenging role that will further your IBM Software Implementation skills your strong team working ethics and your dedication to every client success.  What Awaits?  A number of new and exciting projects opportunities to work on large composite systems and be part of an elite team who is at the cutting edge of implementing IBM solutions working with prestige clients to deliver value from their Automation and Enterprise Asset Management solutions. Working alongside our talented and widely experienced consultants you’ll have the opportunity to determine innovative solutions which overcome complex business challenges. On a daily basis you’ll transform asset management performance and deliver real business improvements for our clients. Whether it is strategy and planning or procurement and maintenance your advice will help our clients to operate more efficiently and effectively. Ideally you will engage in all key phases of full projects life-cycle from pre-sales activities implementation and training our customers. You are expected to be able to hit the ground running as a confident and professional communicator who prides themselves on delivery excellence. As well as a motivated and enthusiastic approach you’ll need plenty of ambition and a talent for teamwork.,,,,,,,,,
Senior Administrative Assistant,Cairo,Poverty Action Lab,Full Time,Posted 9 days ago,Not Specified,Not specified,Not Specified,Confidential,Senior Administrative AssistantOrganization: Location:  EgyptStart Date (Earliest): 15 October 2023 Start Date (Latest): 15 November 2023 Length of Commitment: One year Summary of the Organization: regional office is based at The American University in Cairo School of Business. J-PAL (povertyactionlab.org) is a global research center working to reduce poverty by ensuring that policy is informed by scientific evidence. Anchored by a network of more than 200 affiliated professors at universities around the world J-PAL draws on results from randomized impact evaluations to answer critical questions in the fight against poverty.Summary of the RoleUnder the supervision of the Director J-PAL Finance & Operations the Senior Administrative Assistant provides administrative support across J-PAL MENA growing operations and executive assistance to the Executive Director. The Senior Administrative Assistant will support events and high- level meeting planning coordinate office knowledge management and some cloud-based knowledge management systems support human resources logistics scheduling and conduct other tasks as needed. This position requires working with utmost professional standards efficiency and playing an essential role in keeping the workflow running smoothly.ResponsibilitiesSenior Management Team Support:  Coordinate the daily agenda and activities of the SMT including coordination and scheduling of meetings appointments interviews preparation of documents spreadsheets and keeping record of their meetings and appointments Support Executive Director calendaring with internal and external meetings and travel Perform other related duties as required. Office Support:  Support day-to-day operations of a growing office at AUC including meeting visitors arranging for high-level meetings Manage office supplies and materials including print publications Maintain office e-mail listservs and other contact databases Support office renovation and furnishing updates Order equipment & office supplies Coordinate with AUC offices and stakeholders across university Expand and maintain office knowledge library internal website Keep personnel and project records up to date on Salesforce Support day-to-day administration of large complex research policy and training projects supported by a range of donors and requiring administrative collaboration with several AUC support offices (travel procurement etc.) working closely with research research operations and policy staff who manage individual projects. Support the hiring and onboarding process of new center staff including email and ID set-up desk and laptop set-up preparing welcome materials and communicating scheduleHow to ApplyPlease apply through the . And upload a cover letter and a CV or resume. The cover letter should discuss your fit for and interest in the position and J-PAL.,,,,,,,,,
Cash Management Accountant Suez Egypt Posted on 10/22/2023,Suez,Cargoes,Full Time,Posted 9 days ago,Not Specified,Not specified,Not Specified,Confidential,Job DescriptionMain Responsibilities:- Handle reimbursement Petty cash with DPWS staff in weekly base. Upload DPWS payments through Oracle Fusion in weekly base. Manage Letters of guarantee file in monthly base. Upload DPWS Transfers payment through Bank Portal in weekly base. Follow our Bank balances & transactions in daily base. Preparing the VAT & Salary tax payments in monthly base. Preparing the WHT analysis & payment in quarterly base. Follow up and coordinate Vendor payments with Payable team. Handle any requirements / documents red for issue letter of cred Procurement team. Handle any reequipments related for transfers documents with bank as the follow rules for foreign transfers.Qualification and Skills:- Bachelor's Degree – Commerce Professional finance course Work Experience minimum 1-3 years Ability to take initiative and problem solving with minimal direction Strong problem-solving skills basic accounting principles knowledge documentation skills research and resolution skills data analysis and multi-tasking skills Qualified communication skills in English both oral & written.Cash Management AccountantSuez Egypt Job Info Job Identification 8055 Posting Date 10/22/2023 01:52 PM Apply Before 11/05/2023 01:52 PM Locations Ain Sokhna Suez - Egypt 133 EG Page Cash Management Accountant - DP World Careers loaded,,,,,,,,,
Project Manager - Data Networks (ICT),Cairo,SABA,Full Time,Posted 9 days ago,2 to 5 years,Experienced (Non-Manager),Bachelor's Degree,Confidential,We are looking for an experienced Project Manager to manage organization of key client projects. Responsibilities:  Create & manage project plans Define project schedules allocate resources and monitor progress Make sure project team is clear on objectives Help project team with the tasks Lead process of issue identification and resolution Manage risk tracking process Monitor and manage scope Manage all documentation Work multiple projects simultaneously Foster partnership with customers/stakeholders/sponsors Ensuring that all projects are delivered on-time within scope and within budget Manage change requests professionally,,,,,,,,,
Graphic Designer,Cairo,Ejada,Full Time,Posted 9 days ago,3 to 5 years,Experienced (Non-Manager),Bachelor's Degree,Confidential,Role and ResponsibilitiesDesign Creation: Develop creative and original design concepts for a variety of projects including but not limited to logos brochures posters banners social media graphics websites mobile apps and more.Visual Identity: Create and maintain consistent visual branding elements ensuring that designs align with the organization's brand guidelines and convey the desired message.Client Collaboration: Work closely with clients or project managers to understand their design requirements objectives and target audience and translate these into effective visual solutions.Research: Conduct research to stay updated on design trends industry standards and best practices to continually enhance the quality and impact of design work.Software Proficiency: Utilize graphic design software tools such as Adobe Creative Suite (Photoshop Illustrator InDesign) CorelDRAW or other relevant software to create and edit designs.Layout and Composition: Arrange visual elements (images typography color schemes etc.) in a visually pleasing and balanced manner to create aesthetically pleasing designs.Print and Production: Prepare designs for print production ensuring that they meet the necessary specifications and requirements.Digital Design: Create graphics and visual assets for digital platforms including websites social media and mobile applications optimizing them for different screen sizes and resolutions.Collaboration: Work closely with cross-functional teams including marketing copywriters and web developers to ensure cohesive and integrated design solutions.Feedback and Iteration: Receive feedback from clients and team members and make necessary revisions to designs based on feedback and requirements.Project Management: Manage multiple projects simultaneously adhering to deadlines and ensuring that design projects are delivered on time and within scope.,,,,,,,,,
Front End Team Lead,Giza,Sarmady,Full Time,Posted 9 days ago,5 to 8 years,Manager,Not Specified,Confidential,Lead development of front-end best practices and frameworks enabling the development team to produce consistent maintainable secure and performant user interfaces.Set up development plans for the front-end team.Collaborate with cross-functional teams including designers backend developers QA teams and stakeholders to design and implement robust frontend applications using Angular JavaScript HTML5 and CSS3.Conduct code reviews to ensure quality output.Worked with a cross-functional full-stack development team and had prior experience building cross-platform responsive high-performing user interfaces for web applications.Design and develop scalable web applications using open-source technologiesDeveloping and maintaining high-quality web applications using AngularDevelop responsive web applications using HTML5 CSS and Javascript and associated Javascript frameworks for desktop tablet and mobile platformsWork with UX Designers and other Developers to implement full-stack web solutions.Optimizes application for maximum speed and scalability.Keeping up to date with the latest technologies and trends in front-end development,,,,,,,,,
Senior Front-End Developer,Giza,Sarmady,Full Time,Posted 9 days ago,3 to 5 years,Experienced (Non-Manager),Not Specified,Confidential,Responsibilities: Work with a cross-functional full-stack development team and had prior experience building cross-platform responsive high-performing user interfaces for web applications.Design and develop scalable web applications using open-source technologiesDeveloping and maintaining high-quality web applications using AngularDevelop responsive web applications using HTML5 CSS and Javascript and associated Javascript frameworks for desktop tablet and mobile platformsWork with UX Designers and other Developers to implement full-stack web solutions.Optimizes application for maximum speed and scalability.Keeping up to date with the latest technologies and trends in front-end development,,,,,,,,,
Business Analyst - Supply Chain Business Control,Cairo,Heineken,Full Time,Posted 9 days ago,Not Specified,Not specified,Not Specified,Confidential,At ABC we brew the joy of true togetherness to inspire a better world. A big part of that means brewing better people with the heart of our company in our four values:Passion for consumers and customers Care for people and planet Enjoyment of life Courage to dream and pioneerJob PurposeActs as a business partner to the Supply Chain department and assists in controlling the budget as well as setting and achieving financial targets.Duties and Responsibilities1. Acts as a business partner in the plants assisting them in budgeting and controlling and expenditures.2. Uploads the plants' financial data on the designated systems.3. Runs the monthly closing process in the plants. Reconciles the plants' expenses recorded on the system against the actual expenses.4. Runs Cost of Goods Sold (COGS) analysis in terms of volume price and efficiency.5. Supports the planning of OpEx COGS and working capital in the plants.6. Follows up on CapEx and OPEX on a weekly basis.7. Manages the working capital i.e. inventory and payables pillar for raw and pack materials.8. Consolidates all the working capital in terms of inventory and payables and reports the analysis.9. Supports various ad-hoc projects such as: opportunity assessment projects raw material bucket working capital for raw material etc.10. Submits financial reports as requested by the regional global or local offices.11. Acts as a support during external audits and provides any required financial documents and reports.12. Attends planning and Daily Control System (DCS) meetings at the plants.13. Manages opportunity assessment projects such as New Product Introduction (NPI) in terms of production costs and financial impact.14. Develops and submits reports in a timely manner such as: Volume Price Mix (VPM) for COGS and for utilities Fayrouz Elimination report Internal Control Process report Working Capital report OpEx and CapEx report etc.Education & ExperiencesEducational Background: Bachelor's degree in Commerce majoring in Finance or AccountingYears of Experience: 1-3 years of relevant experience preferably in FMCGs.Qualifications & Other RequirementsExcellent command of English Language Skills in Microsoft (Excel & PowerPoint) and Power Bi is a plus Profound experience with advanced ERP systems e.g. SAPPersonal SkillsCritical and Challenging Analytical Skills Interpersonal & Communication Skills High Persuasion and Negotiation skills Pro-active & Teamwork oriented,,,,,,,,,
Senior Pega Developer,Cairo,Giza Arabia Systems,Full Time,Posted 9 days ago,Not Specified,Not specified,Not Specified,Confidential,Senior Pega DeveloperJob DescriptionThe person in this role will be expected to demonstrate technical leadership in the selection of technologies tools and designs in the evolution of the platform. Responsible for the development and maintenance of the Pega application & interfaces. Update and Maintain documents that include guardrails and best practices by implementing necessary policies and also train others in the critical success factors of the policy. Assist with troubleshooting and debugging of Pega applications to clearly identify the root cause of production-level architecture issues and make practical suggestions with proof-based technical reasoning. Concentrate on providing innovative solutions to more complex business needs. Actively take a leading role and participate on project teams in various project roles including but not limited to Developer Technical Lead and Project Manager based upon level of experience. Effectively communicate with team members customers partners and management including assisting with or conducting more complex technical walk-throughs reporting project status enabling vendor solutions and providing accurate and concise documentation As a PEGA Developer you will be responsible for designing developing and supporting PEGA-based applications as specified by our business partners. Developing new features and problem identification and resolution.Personal Skills Have experience building distributed service oriented. Demonstrate ability to utilize Scrum continuous integration and TDD in order to build scalable reusable well-tested and maintainable software. Self-starting and can work autonomously in a larger team. Committed to following best practices.Technical SkillsBachelor’s degree in computer science or similar Proven work experience as a Pega developer at least 4 years. Advanced knowledge of Pega PRPC 5.x/6.x/7. x. Strong Knowledge of J2EE XML Java JSP and EJB. Familiarity with Scrum and Agile methodology. Knowledge of coding languages including Angular JS and JQuery. Knowledge of web technologies including JavaScript CSS HTML5 and XML.Job Location Cairo Egypt Job Role Information Technology Years of Experience Min: 4 Max: 7,,,,,,,,,
Senior Full Stack Developer (on-site),Giza,Union Coop,Full Time,Posted 9 days ago,More than 4 years,Experienced (Non-Manager),Bachelor's Degree,Confidential,We are seeking a skilled Full Stack Developer with a minimum of 4 years of experience to join our dynamic team. The ideal candidate will have expertise in both front-end and back-end technologies and be proficient in using .NET Framework .NET Core ASP.NET Core Entity Framework SQL Server RESTful APIs DevExpress Libraries HTML CSS Bootstrap JavaScript Angular or TypeScript. The successful candidate will be responsible for designing and implementing scalable and efficient software solutions as well as working collaboratively with cross-functional teams to deliver high-quality projects. Responsibilities:Design develop and maintain software applications using .NET Framework .NET Core and ASP.NET Core.Work with cross-functional teams to identify design and implement software solutions that meet customer requirements.Develop and maintain database structures using SQL Server and Entity Framework.Create RESTful APIs to enable seamless communication between front-end and back-end systems.Use DevExpress Libraries to design and implement user-friendly interfaces.Write clean efficient and well-documented code in HTML CSS Bootstrap JavaScript Angular or TypeScript Ensure that all software solutions are scalable secure and optimized for performance.Troubleshoot and debug software issues as they arise.Stay up-to-date with emerging trends and technologies in software development.,,,,,,,,,
Senior Java Developer,Giza,Algoriza,Full Time,Posted 9 days ago,3 to 6 years,Experienced (Non-Manager),Not Specified,Confidential,Strong expertise in Core Java and Object-Oriented Programming (OOP).Excellent knowledge of database design concepts.Proficiency in SQL (MySQL) and NoSQL databases (MongoDB Elasticsearch).Solid understanding of Spring Data and Design Patterns.Extensive experience in designing RESTful APIs.Good experience with Message Queues (Kafka RabbitMQ).Proficiency in writing Unit tests.Familiarity with cache technologies like EH cache Redis etc.Competency in Sockets Programming.Participates as a member of the development team.Works on problems/projects of moderate complexity.Offers informed analysis and limited project direction input.Performs basic analysis of functional or business requirements.Completes code stubs prepared by more senior developers.Participates in code reviews.Prepares and executes Unit tests.Applies advanced technical knowledge to maintain one or more technology areas.Performs solution design.Utilizes Contractor Systems and 3rd party technologies to develop infrastructure and software solutions of moderate complexity.Implements end-user or enterprise infrastructure or services as guided by senior technologists.Evaluates unique circumstances and makes recommendations.,,,,,,,,,
