Title,City,Company,Type,Date Posted,Experience Needed,Career Level,Education Level,Salary,Description,,,,,,,,,
Head OF Operations,Cairo,Nerva,Full Time,Posted 22 days ago,4 to 5 years,Senior Management (CEO GM Director Head),Not Specified,Confidential,Strategic Planning and Execution: Develop and implement strategic plans policies and procedures to drive operational excellence and achieve company objectives.Collaborate with senior management in setting business goals defining key performance indicators (KPIs) and monitoring progress towards targets.Operations Management: Set-up lead and supervise a diverse team of professionals across multiple departments including finance accounting and IT ERP.Oversee day-to-day operations ensuring efficient resource allocation workload distribution and effective utilization of technology and tools.Continuously monitor and optimize operational processes to enhance productivity quality and client satisfaction.Client Relationship Management: Foster strong relationships with clients understanding their unique business requirements and ensuring their expectations are met or exceeded.Proactively identify opportunities for process improvements and innovative solutions to enhance client operations and drive business growth.Financial Management: Collaborate with the finance team to develop and manage budgets financial forecasts and cost control measures. And cost control measures.Analyze financial data identify trends and implement strategies to improve operational efficiency and profitability.Quality Assurance and Compliance: Develop and implement quality assurance programs to maintain the highest standards of service delivery.Ensure compliance with industry regulations data protection policies and security protocols.Team Development: Mentor train and motivate team members fostering a culture of continuous learning growth and professional development.Conduct performance evaluations and provide feedback to drive individual and team performance improvement.,,,,,,,,,
Vice president of Technology,Cairo,Auto Tager,Full Time,Posted 22 days ago,12 to 20 years,Senior Management (CEO GM Director Head),Not Specified,Confidential,JOB SUMMARY:The Vice President Technology will provide effective leadership direction and professional expertise in all areas oftechnology and engineering for the regional heads in the achievement of revenue and profit goals. You will be astrategic business partner to the CTO and an integral member of the management team that establishes thestrategic goals and objectives on behalf of Autochek. CORE JOB FUNCTION▪ Takes responsibility for the Strategic & operational control and execution of Autochek technology and product development cycle from the early conceptual phase through research and development advanced engineering product development application engineering and validation product launch and post-SOP support.▪ Provide leadership to a regionally distributed team of professionals through an organization that is both solid-line and matrix▪ Responsible for Enterprise Solution & Architecture Design and establishing both the long term-strategy and technology roadmap as well as the short-term tactical goals and objectives to ensure quarterly and annual commitments are delivered.▪ Work with peers as the technical visionary to provide a strategy and process to deliver innovative products to the market at the right time▪ Passionately drive continuous improvement initiatives across all facets of the engineering function. Benchmark internally and externally while driving the engineering & technology organization towards best-in-class performance▪ Coach Managers and Leads in setting their long-term career path.▪ Maintain manage and establish as necessary key performance indicators (KPIs) to drive continuous improvement▪ Manage the technology/engineering annual budget to ensure objectives are met within financial and resource constraints,,,,,,,,,
Senior Application Support Engineer,Cairo,GET Group- Egypt,Full Time,Posted 22 days ago,More than 4 years,Experienced (Non-Manager),Bachelor's Degree,Confidential,This vacant:-Hybrid Attendance ( 3 Days from the office - 2 Days from Home) from the office either the Maadi office or Sheraton office.-Flexible Working Hours.Main Responsibility:Responsible for implementation of the SW Architect.Responsible for the software installation process for clients as per GET standards.Conduct training sessions for clients on newly installed Software products.Provide technical client support and issue resolution remotely (via email phone and other electronic medium) or onsite.Conduct live demos to introduce Software products to clients.Provide guidance to team members on customer problems.Solve complex maintenance problems using software diagnostic.Diagnose Research troubleshoot and identify solutions to software issuesInstalling customized software systems and all necessary components.,,,,,,,,,
Senior Frontend Developer- Angular,Cairo,Egabi FSI,Full Time,Posted 22 days ago,4 to 7 years,Experienced (Non-Manager),Bachelor's Degree,Confidential,Demonstrated experience with JavaScript HTML5 CSS3 and related technologies Working knowledge and understanding of the following: RESTful web services Javascript jQuery AJAX JSON HTML5 CSS3 Git NPM Experience with Javascript MVC frameworks as Angular preferred. Ability to write complex programs analyze code changes and make suggestions to improve code complexity for maintainability and scalability. Ability to reason logically and creatively identify problems draw valid conclusions from the data available and develop effective solutions while applying creative thinking in the design and development of high-performing web applications Knowledge and demonstrated experience with cross-browser and cross-platform issues (IE Firefox Safari etc.) Goal-oriented and self-motivated. Candidate must have the ability to work independently or within a team environment. Strong oral and written communications skills with the ability to create software design and engineering documents. The ability to multi-task and deliver high-quality work under tight deadlines is essential. The ability to work in a fast-paced environment is crucial. The ability to learn excel and deliver at a quick pace is required.,,,,,,,,,
Financial Manager (Hospitality and Real Estate) in KSA,Cairo,Nerva,Full Time,Posted 22 days ago,4 to 5 years,Senior Management (CEO GM Director Head),Not Specified,Males preferred,Confidential,,,,,,,,,
Senior Channel Sale Manager - Fortinet,Cairo,Giza Arabia Systems,Full Time,Posted 22 days ago,Not Specified,Not specified,Not Specified,Confidential,Senior Channel Sale Manager - FortinetJob Description Carry quarterly and annual revenue targets. Build revenue and non-revenue detailed business plans with these partners that captures details and commitment from each partner on how/where they will grow. Provide ongoing sales and technical trainings to these partners. Conduct QBR’s sales alignment sessions leadership meetings with partners. Closely monitor objectives and provide critical performance feedback. Gain knowledge insight and understanding from key decision-makers regarding customer needs. Build company credibility brand value and trust with your stakeholders. Actively identify drive and own partner led pipeline and conduct regular opportunity reviews with partners. Track measure and manage partners’ success against metrics to maximize results. Develop build and maintain strong business relationships with “partner” executives (including C-level) across sales marketing and delivery teams.Personal Skills• Strong written presentation analytical and interpersonal skills• Ability to anticipate and understand clients’ business needs.• Competitive Self-starter Hunter-type mentality.Technical Skills• 5 years in account management for a channel sales organization. • Strong sales background with proven record of success; experience in the Security industry direct sales is a must. Preferably with Fortinet.EducationBachelor’s degree in a relevant field.Job Location Cairo Egypt Job Role Sales Years of Experience Min: 7 Max: 10 Residence Location Egypt,,,,,,,,,
Head of Technical Delivery-Smart Solutions,Cairo,Giza Arabia Systems,Full Time,Posted 22 days ago,Not Specified,Not specified,Not Specified,Confidential,Head of Technical Delivery-Smart SolutionsJob Description Lead the delivery of all technical delivery in projects and services activities related from a technical and business side. Engage with the LoB management to develop a cohesive strategy for the growth of the LoB service across the different countries. Guide the technical teams to work closely with the project manager to ensure projects experiences and clients’ needs and expectations are fulfilled. Participate in the review of: Systems Requirements Analysis Systems Deliver Specs User Procedure Documents and Training Documents. Lead and manage the delivery of a high quality service to clients. Work closely with the presales and the PM functions to make sure that experience is entrenched in future offers and tenders. Investigate and develop potential service opportunity sales in coordination with the sales team and the project management. Review and ensure that the projects in LoB are delivered in a manner that ensure a sustainable revenue. Review and ensure assignment of the technical teams on all projects and opportunities. Provide technical assistance to the PM project teams and might attend key Client meetings. Ensure the quality and timeliness of service delivery to clients. Ensure that the knowledge of all technical delivery is shared across the LoB and maintained for future reference. Ensure efficient processes are implemented. Work closely with the quality teams to ensure excellent quality experience for the client. Ensure compliance with Giza Systems policies process and procedures including HSSE. Lead technical teams across regions. Promote and foster a strong team culture and open and transparent communication. Assess skills knowledge and abilities of candidates to make effective hiring and merit/bonus decisions and identified developmental needs Provide training and development opportunities and serve in mentoring role for team. Personal Skills Excellent project management skills Excellent communication and negotiation skills Excellent technical report writing skills Excellent command of English Technical Skills• Bachelor of Engineering with a specialization in Electronics Communication Mechatronics or Power Engineering. • Minimum 15 years of technical experience 5 - 8 years of them in the field of low current building automation & management systems. • Good practical experience in Multimedia BMS low current building automation & management systems & Security Systems • MBA is an asset • Excellent knowledge about SLA termsEducationBachelor of Engineering with a specialization in Electronics Communication Mechatronics or PowerJob Location Cairo Egypt Job Role Engineering Years of Experience Min: 15 Max: 20 Job Role: Engineering Experience: 2 - 5 Years of Experience Job Role: Engineering Experience: 5 - 8 Years of Experience Job Role: Engineering Experience: 2 - 4 Years of Experience Job Role: Engineering Experience: 2 - 5 Years of Experience Job Role: Engineering Experience: 5 - 8 Years of Experience Job Role: Engineering Experience: 2 - 5 Years of Experience Job Role: Engineering Experience: 5 - 8 Years of Experience Job Role: Engineering Experience: 2 - 4 Years of Experience Job Role: Engineering Experience: 2 - 5 Years of Experience Job Role: Engineering Experience: 5 - 8 Years of Experience Job Role: Engineering Experience: 2 - 5 Years of Experience Job Role: Engineering Experience: 5 - 8 Years of Experience,,,,,,,,,
Technical Support,Cairo,Basata,Full Time,Posted 22 days ago,2 to 4 years,Experienced (Non-Manager),Not Specified,Confidential,• Install and configure computer hardware systems networks printers scanners operating systems and applications.• Support staff either face-to-face over the phone or ticketing system for resolving issues.• Responding in a timely manner to service issues and requests.• Troubleshoot system and network problems diagnosing and solving hardware or software faults.• Replace PCs/Laptops parts as required.• Provide support including procedural documentation and relevant reports.• Follow diagrams and written instructions to repair a fault or set up a system.• Set up new users' accounts and profiles and deal with policy issues.• Prioritize and manage many open cases at one time.• Test and evaluate new technology and current HW equipment.• Install and configure network cabling patch panels switches and UPS points.• Manage and update IT store records periodically (PCs Laptops IP Phones ... & different IT devices).,,,,,,,,,
Oracle Developer,Cairo,Arabian Advanced Systems,Full Time,Posted 22 days ago,3 to 5 years,Experienced (Non-Manager),Not Specified,Confidential Family Medical & Life Insurance,Design and develop Oracle database solutions based on business requirements.Create and modify database objects such as tables views indexes and stored proceduresQuery Optimization:Optimize SQL queries for performance and efficiency.Troubleshoot and resolve database performance issues.Data Modeling:Develop and maintain data models for the database schema.Ensure data integrity and normalization.PL/SQL Development:Write and optimize PL/SQL code for various database functions.Develop and maintain stored procedures triggers and functions.Data Migration and Integration:Assist in data migration activities between different databases.Integrate Oracle databases with other applications as needed.Performance Tuning:Monitor and tune database performance.Identify and resolve bottlenecks and other issues affecting performance.Security:Implement and maintain database security measures.Ensure data privacy and compliance with relevant regulations.Backup and Recovery:Develop and maintain database backup and recovery processes.Test and implement disaster recovery procedures.Documentation:Document database design processes and procedures.Create technical documentation for code and configurations.Collaboration:Collaborate with other developers analysts and stakeholders to understand business requirements.Work with other IT teams to integrate Oracle solutions into larger systems,,,,,,,,,
Senior DevOps Engineer,Cairo,Giza Arabia Systems,Full Time,Posted 22 days ago,Not Specified,Not specified,Not Specified,Confidential,Senior DevOps EngineerJob DescriptionWe are seeking an experienced and talented Senior DevOps Engineer to join our dynamic team. As a Senior DevOps Engineer you will play a crucial role in optimizing our software development and deployment processes ensuring scalability reliability and security of our infrastructure and driving continuous improvement in our DevOps practices. Infrastructure Automation: Design build and maintain infrastructure as code (IAC) using tools like Terraform Ansible or similar technologies to automate provisioning and configuration management. Continuous Integration/Continuous Deployment (CI/CD): Develop and maintain CI/CD pipelines using tools like Jenkins GitLab CI/CD or similar to automate the build test and deployment processes. Containerization and Orchestration: Implement and manage containerization solutions (Docker) and container orchestration platforms (Kubernetes) to improve scalability and resource utilization. Monitoring and Logging: Set up and manage monitoring alerting and logging systems (e.g. Prometheus ELK stack Grafana) to ensure the health and performance of the infrastructure and applications. Security and Compliance: Implement security best practices perform vulnerability assessments and ensure compliance with industry standards (e.g. PCI-DSS HIPAA) in collaboration with the security team. Collaboration: Collaborate closely with development QA and operations teams to optimize the DevOps pipeline and improve the overall software development lifecycle. Troubleshooting and Incident Response: Participate in incident management and provide support for resolving production issues promptly. Capacity Planning: Monitor system performance and resource utilization and plan for capacity scaling as needed. Documentation: Maintain clear and up-to-date documentation of infrastructure processes and configurations. Mentorship: Provide mentorship and guidance to junior DevOps team members.Personal Skills Good command of the English language. Strong problem-solving and analytical skills. Excellent communication and collaboration skills. Ability to work well in a team environment. Attention to detail and ability to manage multiple tasks simultaneously. Strong time management and organizational skills. Technical Skills• Bachelor's degree in computer science Information Technology or related field (or equivalent work experience). • Proven experience as a DevOps Engineer or similar role for at least 4 years. • Strong knowledge of cloud platforms (AWS Azure GCP) and their services. • Proficiency in scripting and automation (e.g. Shell Python Ruby). • Expertise in configuration management tools (e.g. Ansible Puppet Chef). • Experience with containerization and orchestration tools (Docker Kubernetes). • Hands-on experience with CI/CD tools (Jenkins GitLab CI/CD). • Knowledge of monitoring and logging tools (Prometheus ELK stack Grafana). • Strong understanding of security best practices and compliance standards. • Excellent problem-solving and troubleshooting skills. • Strong communication and teamwork abilities. • Relevant certifications (e.g. AWS Certified DevOps Engineer Certified Kubernetes Administrator) is a plus.Job Location Cairo Egypt Job Role Engineering Years of Experience Min: 4 Max: 6,,,,,,,,,
Data Engineer,Cairo,Erada,Full Time,Posted 22 days ago,2 to 3 years,Experienced (Non-Manager),Not Specified,0 to 0 EGP Per Month,1. Design and develop scalable and robust data pipelines to ingest process and transform large volumes of data from various sources including Oracle databases. 2. Leverage your expertise in Oracle databases to optimize query performance implement efficient indexing strategies and fine-tune the data processing pipeline for enhanced data retrieval. 3. Implement data modeling techniques to structure data in a way that optimizes performance and supports analytical needs. 4. Build and maintain data warehouses data lakes and other storage systems including Oracle-based solutions to ensure efficient data storage retrieval and availability. 5. Collaborate with data scientists and analysts to understand their data requirements and provide them with reliable and well-organized datasets for analysis and modeling leveraging your Oracle experience to support complex financial data structures. 6. Develop and maintain ETL (Extract Transform Load) processes to integrate data from multiple sources into a unified format suitable for analysis. 7. Optimize and tune data processing and storage systems for improved performance scalability and reliability in financial services environments. 8. Implement data governance and security measures to ensure data integrity confidentiality and compliance with regulatory requirements in the financial services industry. 9. Stay up to date with emerging technologies and industry trends in data engineering and proactively propose innovative solutions to enhance our data infrastructure. 10. Lead and mentor junior data engineers providing technical guidance and sharing best practices for data engineering processes and technologies in Oracle and financial services contexts. 11. Collaborate with cross-functional teams to identify and prioritize data engineering projects and initiatives that align with business goals and strategies in the financial services domain.,,,,,,,,,
Consultant (Gender and Social Inclusion),Cairo,WorldFish,Full Time,Posted 22 days ago,Not Specified,Not specified,Not Specified,Confidential,About WorldFish“WorldFish is a leading international research organization working to transform aquatic food systems to reduce hunger malnutrition and poverty. It collaborates with international regional and national partners to co-develop and deliver scientific innovations evidence for policy and knowledge to enable equitable and inclusive impact for millions who depend on fish for their livelihoods. As a member of CGIAR WorldFish contributes to building a food- and nutrition-secure future and restoring natural resources. Headquartered in Penang Malaysia with country offices across Africa Asia and the Pacific WorldFish strives to create resilient and inclusive food systems for shared prosperity. For more information visit: www.worldfishcenter.org” Background of the ProjectIn June 2023 WorldFish has partnered with the Royal Norwegian Embassy in Cairo to initiate Center for Renewable Energy in Aquaculture (CeREA) project. A 4-year groundbreaking initiative to refine test and scale innovative renewable energy solutions that enable 5000 fish producers processors and other fish value chain actors in Egypt to increase their productivity and incomes leading to improved food and nutrition security reduced food waste and loss and more energy-efficient and climate-smart food value chains.Center for Renewable Energy in Aquaculture (CeREA) key interventions seek to:Refine test and scale innovative renewable energy solutions that enable fish value chain actors in Egypt to increase their productivity and income leading to improved food and nutrition security reduced food waste and loss and more adaptation to energy-efficient and climate-smart systems. Deployment of appropriate renewable energy technologies for aquaculture along with efficient planning ad capacity building for scaling the Egyptian aquaculture sector in a sustainable climate-friendly and inclusive manner to support both economic growth and protein needs of the country’s rapidly expanding population. Consultancy objectives:Development of a gender-sensitive assessment tool which has to consider intersectionality through integrating socio-economic inclusion across multiple dimensions of the Egyptian aquaculture value chain Identify critical factors that limit women and youth participation engagement and highlighting viable pathways to ensure that (CeREA)’s selected innovations for piloting and scaling are strongly integrating gender and social inclusion across different project outputs. Identify opportunities for women and youth empowerment along the Egyptian aquaculture value chain with considerations to climate-change constrains. Design of a gender-sensitive and inclusive strategy for (CeREA)’s 4-years strategic implementation. Scope of Consultancy:WorldFish seeks to hire a gender and social inclusion international consultant. S/he is to join another two consultants in designing and developing a baseline study that shall addresses solutions for optimizing renewable energy solutions aimed at tackling key challenges within Egyptian aquaculture value chain.The mentioned-study requires development of key instrumental surveying tools that mainly focus on:Carrying out a gender assessment for analyzing gender and social inclusion gaps challenges and opportunities using (Micro Meso and Macro) analyses among other tools (e.g. S.W.O.T analysis). Integrating gender and youth specific approaches to enhance social inclusion dimensions for increasing their participation in (CeREA)’s different activities (e.g. entrepreneurship opportunities for women processors fish retailers and small-scale farmers). Piloting at least two or three gender transformative approaches (GTAs) in the research cites to determine the best GTA approach that can be scaled to advance the work of promoting the use of climate-smart and renewable energy in the CeREA project. Submission of a preliminary report of key-findings and results that have been carried out under the baseline survey of the study for the gender equality and social inclusion domain of the project. Development of (GESI) strategy gender-sensitive assessment tool that will be mainstreamed across the project key interventions until 2027 and submission of consultancy final technical report. The consultant is expected to become familiar with project outcomes and outputs through a desk review of project key documents (e.g. logical framework factsheet etc.). (He/She) will work directly with the baseline study consultants MEL and survey local consultants and WorldFish.,,,,,,,,,
