Title,City,Company,Type,Date Posted,Experience Needed,Career Level,Education Level,Salary,Description,,,,,,,,,
Dot Net Web Developer,Cairo,Tidal,Full Time,Posted 2 hours ago,More than 2 years,Entry Level (Junior Level / Fresh Grad),Bachelor's Degree,Confidential,Handle web-based systemsWork on Microsoft stack (C# ASP.NET MVCNetcore  T-SQL Web API)Develop from scratch in a .NET environment using ASP.NET MVC &Web API frameworkHandle multiple tasks under tight deadlinesAnalysis design and implementation of high-performance software applications and must be able to formulate creative solutions to difficult problems.Working with Entity Framework.Response Web Design BackgroundServer Side development concepts,,,,,,,,,
Full Stack wordpress Developer,Cairo,Osolutions,Full Time,Posted 2 hours ago,2 to 5 years,Experienced (Non-Manager),Not Specified,Confidential,We Are looking for Experienced & professional Full Stack Developer in a wide range of technologies including HTML CSS HTML5 CSS3 CSS frameworks JavaScript jQuery PHP WordPress. Demonstrated ability to develop and deploy robust and dynamic web applications. Skilled in both front-end and back-end development with a strong focus on user experience and functionality.Responsibilities: Develop and maintain responsive web applications using HTML CSS and CSS frameworks.Implement advanced features and functionality using JavaScript jQuery and other front-end technologies.Design and optimize database schemas and write efficient queries for PHP and Laravel applications.Customize and extend WordPress functionality to meet project requirements.Collaborate with cross-functional teams to design develop and deploy high-quality web solutions.Debug and troubleshoot technical issues ensuring smooth operation of web applications.Stay updated with the latest industry trends and emerging technologies in web development.Provide mentorship and guidance to junior developers fostering a collaborative work environment.,,,,,,,,,
Front End Developer,Cairo,Safa Soft,Full Time,Posted 2 hours ago,2 to 5 years,Experienced (Non-Manager),Not Specified,Confidential,We are seeking a skilled React.js Developer with a strong understanding of front-end web development and experience in building user interfaces using React.js. In addition to React.js knowledge of Angular is preferred. As a React.js Developer you will collaborate with the development team to create scalable and responsive web applications implement user interface components and contribute to the overall front-end development efforts. This role requires expertise in React.js proficiency in JavaScript and the ability to work in an agile development environment.Responsibilities:- Front-End Development:Develop user-facing features using React.js and other front-end technologies.Implement responsive and scalable web applications with clean and maintainable code.Collaborate with designers and back-end developers to translate UI/UX designs into functional components.- React.js Component Development:Build reusable and modular React.js components for efficient development and code reuse.Optimize components for maximum performance and reusability.Leverage React.js libraries and tools to streamline development processes.- Cross-Browser and Cross-Platform Compatibility:Ensure that web applications are compatible with various browsers and devices.Perform testing and debugging to identify and fix any issues related to cross-browser or cross-platform compatibility.- Code Quality and Documentation:Follow best practices for code quality maintainability and readability.Write clear and concise documentation for developed components and functionality.Collaborate with the development team to establish coding standards and guidelines.- Collaboration and Agile Development:Work closely with the development team to ensure seamless integration of front-end and back-end components.Participate in agile development processes including sprint planning daily stand-ups and code reviews.Collaborate with designers project managers and stakeholders to understand project requirements and provide input on technical feasibility and implementation.Preferred Knowledge in Angular:While the primary focus of this role is React.js development preferred knowledge in Angular is valued and may involve the following responsibilities:Develop Angular components and applications based on project requirements.Collaborate with other Angular developers and contribute to the overall front-end development efforts.Maintain and enhance existing Angular applications.Stay updated with the latest Angular features tools and best practices.,,,,,,,,,
IT Clerk,Giza,Nahdet Misr Publishing Group,Full Time,Posted 2 hours ago,3 to 5 years,Experienced (Non-Manager),Not Specified,Confidential,IT Admin  will provide administrative support and assist in the smooth operation of the IT systems and processes. The ideal candidate should have strong organizational skills excellent attention to detail and a basic understanding of IT concepts and systems.Help manage IT-related procurement including processing purchase orders tracking deliveries and maintaining vendor relationships.Monitor and maintain inventory of IT equipment and supplies ensuring availability and proper allocation.Researching and selecting hardware software and other IT equipment based on organizational needs tracking equipment and ensuring timely replenishment of IT supplies.IT administrative support often involves liaising with external vendors and service providers. This includes managing vendor relationships coordinating service contracts and resolving issues related to software licenses warranties and maintenance.,,,,,,,,,
SAP SD CX function consultant,Giza,Nahdet Misr Publishing Group,Full Time,Posted 3 hours ago,3 to 4 years,Experienced (Non-Manager),Not Specified,Confidential,Job description:Providing Subject Matter Expertise of best practices in use of SAP Customer Experience (CX)Analyzing and translating business requirements into alternative functional solutions utilizing best practice and within the remit of the enterprise architectureDesigning building and testing SAP solutions in accordance with existing programmed templatesConversing with technical and non-technical audiencesProviding a level of operational support to users including training and remediationProviding guidance and consultancy to business users and other functional consultantsKey Responsibilities:Provide business functional and technical support on SAP Sales and CX solutionsGather requirements and assess gaps in the current business processes and configurationsProvide technology consulting expertise to develop alternatives and recommendations to address gapsDevelop solutions for SAP Sales and CX requirementsLead testing and defect resolution of implemented SAP Sales and CX solutions,,,,,,,,,
Senior Backend Developer (PHP),Cairo,iStoria,Full Time,Posted 3 hours ago,4 to 7 years,Experienced (Non-Manager),Bachelor's Degree,Confidential,As a Senior Developer you will play an integral role in our engineering team responsible for developing and maintaining our backend systems integrating various platforms and ensuring that our applications are optimized and delivered efficiently. Identify and analyze user requirementsPrioritize assign and execute tasks throughout the software development life cycleWrite well-designed efficient codeReview test and debug team members’ codeDesign database architectureEnsure our applications are secure and up-to-dateDesign build and maintain efficient reusable and reliable backend codeDevelop robust APIs to serve the needsSet up and manage Continuous Integration and Continuous Deployment (CI/CD) workflows using GitHub Actions and AWS serverlessIdentify bottlenecks and bugs and devise solutions to these problems,,,,,,,,,
UX Designer,Cairo,Safa Soft,Full Time,Posted 4 hours ago,3 to 5 years,Experienced (Non-Manager),Not Specified,Confidential,We are looking for a user-experience (UX) designer able to understand our business requirements and any technical limitations as well as be responsible for conceiving and conducting user research interviews and surveys and translating them into sitemaps user flows customer journey maps wireframes mockups and prototypes. The UX designer will also be expected to design the overall functionality of the product and in order to ensure a great user experience iterate upon it in accordance with user-testing.Your primary role will be to research and design usable interfaces perform usability testing and create prototypes to validate design concepts. The ideal candidate will use this information to help us create the best user experience possible for our website and mobile applications.As a UX designer you'll ensure that the user experience for individuals using websites or applications is as efficient and satisfying as possible. You'll be involved in the design of digital products and services for specific target groups and end users and will need to understand motivations.Translate concepts into user flows wireframes mockups and prototypes that lead to intuitive user experiences.Leverage a human-centered design process to deliver an easy-to-use user interface and user experienceResearch customers competitors and productsDesign and deliver wireframes user stories user journeys and mockups optimized for a wide range of devices and interfaces.Develop personas scenarios and user storiesWork with stakeholders to identify requirementsDevelop and implement usability testingDesign for accessibility standardsCreate and maintain usability documentationWork with developers to ensure product qualityWork closely with product managers and marketing to maximize customer successEnsure products are tested with customers and validated against business goals,,,,,,,,,
C++ / Qt Developer,Cairo,Fruitful Solutions,Full Time,Posted 4 hours ago,0 to 7 years,Entry Level (Junior Level / Fresh Grad),Not Specified,Confidential,"We are looking for a C++ / Qt Developer with the following requirements :As a frontend/backend software developer you will lead and participate in developing professional desktop applications for our products as well as all software development-related aspects of our technical operations and infrastructure.A motivated candidate.experience in C++ Qt MySQL  Linux ""Ubuntu""Fluent in English.You should be able to create/build Qt applications with database support (MYSQL) before applying for the interview.",,,,,,,,,
Application Support - Microsoft dynamic Ax,Giza,Sky Distribution,Full Time,Posted 4 hours ago,1 to 5 years,Entry Level (Junior Level / Fresh Grad),Not Specified,Confidential,Providing technical support for Microsoft Dynamics AX 2012to business users via IT tickets and other communication channels.Analyzing classifying and prioritizing tickets based on severity and impact.Troubleshooting and resolving technical issues related to Microsoft Dynamics AX 2012.Collaborating with cross-functional teams to resolve complex issues.Escalating issues to higher levels of support when necessary.Documenting issues and resolutions in a knowledge base for future reference.Participating in business testing for the new released features.Understanding the overlapping and integrations rules among the various applications& corporate solutions (Sales Force Automation Ecommerce Retail CRM HRMS …etc.).Monitoring the corporate applications to ensure service availability 24/7Recording and track incidents complaints or requests.Skills to write Change Requests Documents for AX developers,,,,,,,,,
Senior Scrum Master,Cairo,Softec Technologies,Full Time,Posted 5 hours ago,5 to 7 years,Experienced (Non-Manager),Bachelor's Degree,Confidential,We are looking for a senior scrum master to help lead the organization's agile transformation strategy. Scrum masters will be critical in ensuring that development teams and scrum masters follow  Agile framework principles and practices mentoring and motivating teams to improve processes facilitating agile ceremonies and decision-making processes and removing team impediments.To be successful in this role as a senior scrum master you should have past expertise with agile transformations a strong understanding of agile methods and the ability to effectively lead and mentor development teams. A great scrum master should have strong interpersonal project management and problem-solving abilities.Scrum Master Key Responsibilities:Scrum Master Leadership:Provide leadership to multiple scrum teams and support them in adopting and adhering to Agile principles values and practices.Foster a culture of continuous improvement and self-organization within the teams helping them take ownership of their processes and outcomes.Act as a role model for Agile values and behaviors setting a high standard for the organization.Agile Transformation and Framework Implementation:Support in the organisation agile transformation strategy Ensure the effective implementation of the agile framework principles and practices across the organization including the coordination and alignment of Agile Release Trains (ARTs) with portfolio objectives.Collaborate with Portfolio Managers Product Owners and business team roles to ensure consistent and synchronized delivery.Facilitation:Facilitate various Scrum ceremonies Daily stand-ups Sprint planning retrospective and Quarterly Program Increment (PI) Planning bringing cross-functional teams together to plan and prioritize work backlogs for the upcoming PI.Lead Inspect and Adapt (I&A) workshops at the end of each PI focusing on the identification and resolution of systemic issues and continuous improvement.Team Coaching:Provide guidance and coaching to Agile teams and individuals helping them understand and embrace Agile practices and principles.Support the development of high-performing self-organizing teams by offering feedback and guidance on Agile roles and responsibilities.Performance Monitoring:Continuously monitor team velocity performance progress and the execution of their commitments.Identify impediments bottlenecks and roadblocks that hinder progress and work with teams to resolve issues promptly.Conflict Resolution:Effectively manage team and priorities conflict and obstacles that may arise within scrum teams ensuring teams remain focused on their goals and commitments.Encourage open communication collaboration and problem-solving among team members.Stakeholder Engagement:Actively engage with stakeholders Program Managers Business Owners and Product Owners to understand their needs and provide visibility into the progress and delivery of value.Ensure scrum teams alignment and customer satisfaction.Collaboration:Foster collaboration among scrum teams Agile Release Trains (ARTs) and other parts of the organization to promote a culture of transparency and shared objectives.Encourage knowledge sharing and cross-team collaboration to leverage synergies and reduce duplication of effort.Training and Development:Support the professional development of Scrum Masters and scrum teams by providing training guidance and resources.Encourage continuous learning and skill development to help teams adapt to evolving Agile practices.,,,,,,,,,
IT Sales Manager (integrated solutions),Cairo,Injaz Tech for advanced systems,Full Time,Posted 5 hours ago,4 to 6 years,Manager,Not Specified,Confidential commission,#NAME?,,,,,,,,,
UI UX Designer,Cairo,DX Republic,Full Time,Posted 5 hours ago,2 to 5 years,Experienced (Non-Manager),Not Specified,Confidential,Gather and evaluate user requirements in collaboration with product managers and engineers.Illustrate design ideas using storyboards process flows and sitemaps.Design graphic user interface elements like menus tabs and widgetsBuild page navigation buttons and search fields.Develop UI mockups and prototypes that clearly illustrate how sites function and look likeCreate original graphic designs (e.g. images sketches and tables)Prepare and present rough drafts to internal teams and key stakeholders.Identify and troubleshoot UX problems (e.g. responsiveness)Conduct layout adjustments based on user feedback.Adhere to style standards on fonts colors and images.,,,,,,,,,
Senior Flutter Developer,Cairo,DEVOPSOLUTION,Full Time,Posted 6 hours ago,More than 4 years,Experienced (Non-Manager),Bachelor's Degree,Confidential,Our candidate will be Responsible For:Design Build and develop sophisticated and highly scalable mobile apps using Flutter.Build custom packages in Flutter using the functionalities and APIs already available in native Android and IOS.Take ownership of the preparation production and timely release of the applications.Ensure the performance quality and responsiveness of applications.Continuously discover evaluate and implement new technologies to maximize development efficiency.Work with outside data sources and APIs.Follow the best practices while developing the app and also keeping everything structured and well documented.Run functionality testing and debug code.Our Benefits: Medical Insurance.Social Insurance.Training Plan.,,,,,,,,,
Software Quality Assurance Engineer (Process Improvement),Cairo,BI-Technologies,Full Time,Posted 6 hours ago,2 to 3 years,Experienced (Non-Manager),Bachelor's Degree,Confidential Transportation Medical Insurance  Social Insurance  and Retirement Plan,Develops and implements quality assurance problem reporting processes and systems. Design and deploy processes and procedures. For organization departments including (Development Quality Control PS and CS). Establish software metrics in order to measure the effectiveness of this process. Collect the metrics for monitoring and continuous improvement. Audit to get sure that processes and procedures followed as designed per each department. Reports progress reports to QA Manager on regular basis Maintain a keen understanding of SQA trends according to CMMI developments and best practices.,,,,,,,,,
Integration Engineer,Cairo,Obeikan Digital Solutions,Full Time,Posted 6 hours ago,5 to 14 years,Manager,Not Specified,Confidential Annually Bonus,Assist in end-to-end implementation of the integration work stream from the requirement gathering and data mapping to production delivery.Assist in defining the integration and dataflow architecture and evaluate vendors’ web services and API capabilities.Identify gaps in available integration services and work on remediation strategies to ensure stability as the underlying platform technologies continue to evolve.Contribute to the development of ODS external-facing API layer for business partner integration; e.g. mobile apps third-party applications and services.Help assess future API management tools examining capabilities against requirements and performing validation activities as required.Cooperate with the support teams to resolve production incidents and proactively seek opportunities to develop preventative measures to avoid recurrence.Ensure technical standards and architectural best practices are maintained and optimize system integration performance.Comparing integration approaches and assessing their relative strengths and limitations in terms of meeting business goals.Developing integrations in several technologies and languages such as .net  node js Java Oracle SQL XML JSON WebLogic network basics as well as scripting in Linux.,,,,,,,,,
Senior Software Quality Engineer,Cairo,Easy Cash,Full Time,Posted 7 hours ago,5 to 8 years,Experienced (Non-Manager),Not Specified,Confidential,Key responsibility :Requirements Evaluation: Diligently review requirements specifications and technical design documents. Provide timely and constructive feedback to enhance software quality.Test Planning: Craft comprehensive well-structured test plans that encompass every facet of our products. Develop clear and detailed test cases to facilitate thorough testing.Test Coordination: Efficiently estimate prioritize plan and coordinate testing activities ensuring alignment with project deadlines.Types of Testing: Perform diverse testing methodologies including:Functional Testing: Validate that the software functions as anticipated.Smoke Testing : quick test to check if essential functions of a software build are working. It's done to ensure the software is stable before more detailed testing.Integration Testing: Verify the seamless interaction between different components and services.Regression Testing: Confirm the stability of the software after resolving bugs.Black-Box Testing: Assess software from a user's perspective to validate its functionality.API Testing: Validate the reliability and functionality of APIs.Security Testing: Scrutinize the software's security features to identify and rectify vulnerabilities.Performance Testing: Evaluate system performance and scalability to ensure optimal functionality.Testing Processes: Innovatively develop and apply testing processes for new and existing products adapting to evolving client needs and the ever-changing industry standards.Collaboration: Forge seamless collaboration with internal teams including developers and product managers to identify and validate system requirements.Quality Metrics: Rigorously monitor and track quality assurance metrics such as defect densities and open defect counts to drive continuous improvements in software quality.,,,,,,,,,
Senior Backend Developer (PHP),Cairo,Easy Cash,Full Time,Posted 7 hours ago,4 to 6 years,Experienced (Non-Manager),Not Specified,Confidential,Key Responsibilities:Backend Development:Implement server-side logic databases and applications.Ensure the development team follows best practices in coding and architecture.Project Management:Manage and prioritize the team's workload ensuring timely project delivery.Collaborate with other teams including frontend development to ensure seamless integration of server-side and client-side components.Quality Assurance:Implement quality assurance processes to maintain the high quality and reliability of server-side components.Perform code reviews and ensure adherence to coding standards.Scalability and Performance:Optimize server-side components developed in PHP for performance and scalability addressing any bottlenecks or issues.Proactively identify and resolve technical challenges to maintain optimal system performance.Security:Implement and enforce security best practices in server-side development to protect against potential vulnerabilities.Ensure data protection and compliance with security standards.Technical Expertise:Stay current with industry trends and emerging technologies in PHP to make informed decisions and recommendations.,,,,,,,,,
DevOps Engineer,Cairo,Easy Cash,Full Time,Posted 7 hours ago,3 to 7 years,Experienced (Non-Manager),Not Specified,Confidential,Qualifications:Bachelor's degree in Computer Science Information Technology or related field.Proven experience as a DevOps Engineer preferably in the fintech industry.Strong knowledge of on-premises colocation infrastructure management.Proficiency in automation and scripting using tools like Ansible Terraform or Puppet.Experience with CI/CD tools (e.g. Jenkins Bitbucket Pipelines GitLab Runner).Familiarity with containerization and orchestration technologies (e.g. Docker Kubernetes).Experience with Openshift setup and deployment is a plusExperience with ELK for logging and monitoring.Hands-on experience with Queuing systems e.g. Kafka RabbitMQ.Familiarity with issue tracking using JIRA.Strong understanding of security practices and compliance standards.Working knowledge with NIST Container Security practices is a plus.Excellent problem-solving and communication skills.Preferred Qualifications:Relevant certifications such as AWS Certified DevOps Engineer Microsoft Certified: Azure DevOps Engineer Expert or Certified Kubernetes Administrator (CKA).,,,,,,,,,
Senior Full Stack Developer Angular and Java,Cairo,TRIMETIS,Full Time,Posted 7 hours ago,7 to 10 years,Experienced (Non-Manager),Bachelor's Degree,Confidential,Trimetis AG is seeking a new Senior Full Stack Developer to Join our TeamExperience Needed: 8 to 10 years plus.we are more interested that the full-stack profile has stronger frontend (Angular) skills than backend skills (Java).Degree in Computer Science or a relevant fieldVery Good command of English.,,,,,,,,,
Senior Quality Control Engineer,Cairo,Tafeel,Full Time,Posted 8 hours ago,5 to 10 years,Experienced (Non-Manager),Bachelor's Degree,Confidential,We are looking for a Senior Software Quality to assess software quality through manual and automated testing.You will be responsible for finding and reporting bugs to ensure the software changes by technical team is working fine.In this role you will ensure that our products and applications work correctly in terms of technical and business scenario.Receive use cases and create test cases and how everything will be tested and identify the items to be tested.Receive requirements and create a test plan for these requirements.Contact with implementation and development teams to identify issues causing errors.Monitor track and regularly report test status and bug statistics to the team leader.Execute integration test cases to guarantee smooth integrationMake sure that the process is followed through the testing life cycle  and raise flags for any missing flow in the processInspire a positive work environment and help champion quality innovation teamwork and service to the businessWriting and Executing test scriptsParticipate in Estimation and planning sessionsRunning manual and automated testsTesting in different environments including web and mobileWriting bug reportsPerformance testingFunctional testing,,,,,,,,,
